{
  "$schema": "../../schemas/benchmark-fixture.schema.json",
  "schema_version": 1,
  "manifest_kind": "isonclust3-benchmark-fixture",
  "manifest_id": "isonclust3-phanerognostikon-ont-cdna",
  "project": "isONclust3",
  "benchmark_tier": "phanerognostikon",
  "mode": "ont",
  "seeding": "minimizer",
  "source": {
    "description": "Phanerognostikon-scale ONT cDNA workload reserved for formal GB10 producer evidence.",
    "availability": "external_pending",
    "blocker_id": "ISOCLUST-BLOCK-002"
  },
  "platform_targets": ["linux/arm64"],
  "files": [],
  "command": {
    "container_image": "isonclust3:gb10",
    "args": [
      "--fastq",
      "/work/data/reads.fastq",
      "--mode",
      "ont",
      "--outfolder",
      "/work/out/isonclust3",
      "--seeding",
      "minimizer",
      "--no-fastq"
    ]
  },
  "acceptance": {
    "requires_gb10_report": true,
    "requires_container_digest": true,
    "requires_output_checksums": true,
    "status": "blocked_pending_data",
    "blocker_id": "ISOCLUST-BLOCK-002"
  },
  "profiling_plan": {
    "scope": "smallest-accepted-larger-workload",
    "status": "blocked_pending_data",
    "blocker_id": "ISOCLUST-BLOCK-002",
    "required_facets": [
      "seed-generation",
      "minimizer-extraction",
      "quality-filtering",
      "final-clusters-contract"
    ]
  },
  "downstream_handoff": {
    "consumer": "newONform",
    "generated_input_register": "fixtures/generated-inputs/register.json",
    "generated_input_id": "drr178488-final-clusters",
    "consumer_blocker_id": "NOF-BLOCK-006"
  }
}
